Name,Description,Unit,DataType,Attributes
sql_txns_open_internal,Number of currently open user SQL transactions (internal queries),,Gauge,
sql_txn_rollback_started_count,Number of SQL transaction ROLLBACK statements started,,Sum,
sql_txn_begin_count_internal,Number of SQL transaction BEGIN statements successfully executed (internal queries),,Sum,
sql_txns_open,Number of currently open user SQL transactions,,Gauge,
sql_txn_begin_started_count_internal,Number of SQL transaction BEGIN statements started (internal queries),,Sum,
sql_txn_commit_count,Number of SQL transaction COMMIT statements successfully executed,,Sum,
sql_txn_latency,Latency of SQL transactions,,Histogram,
sql_txn_contended_count_internal,Number of SQL transactions experienced contention (internal queries),,Sum,
sql_txn_abort_count_internal,Number of SQL transaction abort errors (internal queries),,Sum,
sql_txn_commit_count_internal,Number of SQL transaction COMMIT statements successfully executed (internal queries),,Sum,
sql_txn_rollback_started_count_internal,Number of SQL transaction ROLLBACK statements started (internal queries),,Sum,
sql_txn_begin_count,Number of SQL transaction BEGIN statements successfully executed,,Sum,
sql_disk_distsql_spilled_bytes_read,Number of bytes read from temporary disk storage as a result of spilling,,Sum,
sql_disk_distsql_spilled_bytes_written,Number of bytes written to temporary disk storage as a result of spilling,,Sum,
sql_distsql_flows_scheduled,Number of distributed SQL flows scheduled,,Sum,
sql_distsql_flows_active,Number of distributed SQL flows currently active,,Gauge,
sql_distsql_flows_queue_wait,Duration of time flows spend waiting in the queue,,Histogram,
sql_distsql_queries_total,Number of SQL queries executed,,Sum,
sql_disk_distsql_max,Disk usage per sql statement for distsql,,Histogram,
sql_distsql_select_count_internal,Number of DistSQL SELECT statements (internal queries),,Sum,
sql_distsql_service_latency_internal,Latency of DistSQL request execution (internal queries),,Histogram,
sql_disk_distsql_current,Current sql statement disk usage for distsql,,Gauge,
sql_distsql_queries_spilled,Number of queries that have spilled to disk,,Sum,
sql_distsql_exec_latency,Latency of DistSQL statement execution,,Histogram,
sql_distsql_queries_active,Number of SQL queries currently active,,Gauge,
sql_distsql_select_count,Number of DistSQL SELECT statements,,Sum,
sql_distsql_service_latency,Latency of DistSQL request execution,,Histogram,
sql_distsql_contended_queries_count,Number of SQL queries that experienced contention,,Sum,
sql_distsql_vec_openfds,Current number of open file descriptors used by vectorized external storage,,Gauge,
sql_distsql_flows_total,Number of distributed SQL flows executed,,Sum,
sql_distsql_exec_latency_internal,Latency of DistSQL statement execution (internal queries),,Histogram,
sql_distsql_flows_queued,Number of distributed SQL flows currently queued,,Gauge,
schedules_scheduled_schema_telemetry_executor_failed,Number of scheduled-schema-telemetry-executor jobs failed,,Sum,
schedules_scheduled_schema_telemetry_executor_started,Number of scheduled-schema-telemetry-executor jobs started,,Sum,
schedules_BACKUP_last_completed_time,The unix timestamp of the most recently completed backup by a schedule specified as maintaining this metric,,Gauge,
schedules_scheduled_sql_stats_compaction_executor_failed,Number of scheduled-sql-stats-compaction-executor jobs failed,,Sum,
schedules_scheduled_sql_stats_compaction_executor_started,Number of scheduled-sql-stats-compaction-executor jobs started,,Sum,
schedules_scheduled_row_level_ttl_executor_started,Number of scheduled-row-level-ttl-executor jobs started,,Sum,
schedules_round_reschedule_skip,The number of schedules rescheduled due to SKIP policy,,Gauge,
schedules_BACKUP_failed,Number of BACKUP jobs failed,,Sum,
schedules_round_jobs_started,The number of jobs started,,Gauge,
schedules_error,Number of schedules which did not execute successfully,,Gauge,
schedules_BACKUP_succeeded,Number of BACKUP jobs succeeded,,Sum,
schedules_round_reschedule_wait,The number of schedules rescheduled due to WAIT policy,,Gauge,
schedules_malformed,Number of malformed schedules,,Gauge,
schedules_scheduled_row_level_ttl_executor_failed,Number of scheduled-row-level-ttl-executor jobs failed,,Sum,
schedules_scheduled_sql_stats_compaction_executor_succeeded,Number of scheduled-sql-stats-compaction-executor jobs succeeded,,Sum,
schedules_BACKUP_started,Number of BACKUP jobs started,,Sum,
schedules_scheduled_schema_telemetry_executor_succeeded,Number of scheduled-schema-telemetry-executor jobs succeeded,,Sum,
schedules_scheduled_row_level_ttl_executor_succeeded,Number of scheduled-row-level-ttl-executor jobs succeeded,,Sum,
rocksdb_compacted_bytes_read,Bytes read during compaction,,Gauge,STRING(3)
rocksdb_memtable_total_size,Current size of memtable in bytes,,Gauge,STRING(3)
rocksdb_encryption_algorithm,"Algorithm in use for encryption-at-rest, see ccl/storageccl/engineccl/enginepbccl/key_registry.proto",,Gauge,STRING(3)
rocksdb_block_cache_pinned_usage,Bytes pinned by the block cache,,Gauge,STRING(3)
rocksdb_num_sstables,Number of storage engine SSTables,,Gauge,STRING(3)
rocksdb_block_cache_usage,Bytes used by the block cache,,Gauge,STRING(3)
rocksdb_flushed_bytes,Bytes written during flush,,Gauge,STRING(3)
rocksdb_read_amplification,Number of disk reads per query,,Gauge,STRING(3)
rocksdb_bloom_filter_prefix_useful,Number of times the bloom filter helped avoid iterator creation,,Gauge,STRING(3)
rocksdb_flushes,Number of table flushes,,Gauge,STRING(3)
rocksdb_compacted_bytes_written,Bytes written during compaction,,Gauge,STRING(3)
rocksdb_ingested_bytes,Bytes ingested,,Gauge,STRING(3)
rocksdb_bloom_filter_prefix_checked,Number of times the bloom filter was checked,,Gauge,STRING(3)
rocksdb_table_readers_mem_estimate,Memory used by index and filter blocks,,Gauge,STRING(3)
rocksdb_block_cache_misses,Count of block cache misses,,Gauge,STRING(3)
rocksdb_compactions,Number of table compactions,,Gauge,STRING(3)
rocksdb_estimated_pending_compaction,Estimated pending compaction bytes,,Gauge,STRING(3)
rocksdb_block_cache_hits,Count of block cache hits,,Gauge,STRING(3)
sql_mem_internal_txn_current,Current sql transaction memory usage for internal,,Gauge,
sql_mem_internal_session_current,Current sql session memory usage for internal,,Gauge,
sql_mem_bulk_current,Current sql statement memory usage for bulk operations,,Gauge,
sql_mem_bulk_max,Memory usage per sql statement for bulk operations,,Histogram,
sql_mem_internal_session_prepared_max,Memory usage by prepared statements per sql session for internal,,Histogram,
sql_mem_sql_txn_current,Current sql transaction memory usage for sql,,Gauge,
sql_mem_root_max,Memory usage per sql statement for root,,Histogram,
sql_mem_sql_session_prepared_current,Current sql session memory usage by prepared statements for sql,,Gauge,
sql_mem_sql_session_current,Current sql session memory usage for sql,,Gauge,
sql_mem_distsql_current,Current sql statement memory usage for distsql,,Gauge,
sql_mem_sql_txn_max,Memory usage per sql transaction for sql,,Histogram,
sql_mem_internal_txn_max,Memory usage per sql transaction for internal,,Histogram,
sql_mem_internal_session_prepared_current,Current sql session memory usage by prepared statements for internal,,Gauge,
sql_mem_internal_session_max,Memory usage per sql session for internal,,Histogram,
sql_mem_sql_session_prepared_max,Memory usage by prepared statements per sql session for sql,,Histogram,
sql_mem_distsql_max,Memory usage per sql statement for distsql,,Histogram,
sql_mem_sql_session_max,Memory usage per sql session for sql,,Histogram,
sql_mem_root_current,Current sql statement memory usage for root,,Gauge,
jobs_create_stats_fail_or_cancel_completed,Number of create_stats jobs which successfully completed their failure or cancelation process,,Sum,
jobs_changefeed_resume_completed,Number of changefeed jobs which successfully resumed to completion,,Sum,
jobs_create_stats_fail_or_cancel_retry_error,Number of create_stats jobs which failed with a retriable error on their failure or cancelation process,,Sum,
jobs_changefeed_fail_or_cancel_retry_error,Number of changefeed jobs which failed with a retriable error on their failure or cancelation process,,Sum,
jobs_create_stats_resume_retry_error,Number of create_stats jobs which failed with a retriable error,,Sum,
jobs_changefeed_fail_or_cancel_completed,Number of changefeed jobs which successfully completed their failure or cancelation process,,Sum,
jobs_create_stats_resume_completed,Number of create_stats jobs which successfully resumed to completion,,Sum,
jobs_changefeed_resume_retry_error,Number of changefeed jobs which failed with a retriable error,,Sum,
jobs_create_stats_currently_idle,Number of create_stats jobs currently considered Idle and can be freely shut down,,Gauge,
jobs_create_stats_resume_failed,Number of create_stats jobs which failed with a non-retriable error,,Sum,
jobs_create_stats_currently_running,Number of create_stats jobs currently running in Resume or OnFailOrCancel state,,Gauge,
jobs_changefeed_resume_failed,Number of changefeed jobs which failed with a non-retriable error,,Sum,
jobs_claimed_jobs,number of jobs claimed in job-adopt iterations,,Sum,
jobs_create_stats_fail_or_cancel_failed,Number of create_stats jobs which failed with a non-retriable error on their failure or cancelation process,,Sum,
jobs_changefeed_currently_idle,Number of changefeed jobs currently considered Idle and can be freely shut down,,Gauge,
jobs_changefeed_currently_running,Number of changefeed jobs currently running in Resume or OnFailOrCancel state,,Gauge,
jobs_changefeed_fail_or_cancel_failed,Number of changefeed jobs which failed with a non-retriable error on their failure or cancelation process,,Sum,
sql_contention_resolver_failed_resolutions,Number of failed transaction ID resolution attempts,,Sum,
sql_contention_txn_id_cache_miss,Number of cache misses,,Sum,
sql_copy_count,Number of COPY SQL statements successfully executed,,Sum,
sql_copy_count_internal,Number of COPY SQL statements successfully executed (internal queries),,Sum,
sql_copy_nonatomic_started_count_internal,Number of non-atomic COPY SQL statements started (internal queries),,Sum,
sql_copy_started_count,Number of COPY SQL statements started,,Sum,
sql_contention_resolver_retries,Number of times transaction id resolution has been retried,,Sum,
sql_copy_nonatomic_started_count,Number of non-atomic COPY SQL statements started,,Sum,
sql_conns,Number of open SQL connections,,Gauge,
sql_contention_resolver_queue_size,Length of queued unresolved contention events,,Gauge,
sql_conn_latency,Latency to establish and authenticate a SQL connection,,Histogram,
sql_copy_started_count_internal,Number of COPY SQL statements started (internal queries),,Sum,
sql_copy_nonatomic_count,Number of non-atomic COPY SQL statements successfully executed,,Sum,
sql_conn_failures,Number of sql conection failures,,Sum,
sql_contention_txn_id_cache_read,Number of cache read,,Sum,
sql_copy_nonatomic_count_internal,Number of non-atomic COPY SQL statements successfully executed (internal queries),,Sum,
raft_rcvd_voteresp,Number of MsgVoteResp messages received by this store,,Sum,STRING(3)
raft_rcvd_heartbeatresp,"Number of (coalesced, if enabled) MsgHeartbeatResp messages received by this store",,Sum,STRING(3)
raft_rcvd_timeoutnow,Number of MsgTimeoutNow messages received by this store,,Sum,STRING(3)
raft_rcvd_queued_bytes,Number of bytes in messages currently waiting for raft processing,,Gauge,STRING(3)
raft_rcvd_transferleader,Number of MsgTransferLeader messages received by this store,,Sum,STRING(3)
raft_rcvd_heartbeat,"Number of (coalesced, if enabled) MsgHeartbeat messages received by this store",,Sum,STRING(3)
raft_rcvd_app,Number of MsgApp messages received by this store,,Sum,STRING(3)
raft_rcvd_prevoteresp,Number of MsgPreVoteResp messages received by this store,,Sum,STRING(3)
raft_rcvd_prop,Number of MsgProp messages received by this store,,Sum,STRING(3)
raft_rcvd_vote,Number of MsgVote messages received by this store,,Sum,STRING(3)
raft_rcvd_stepped_bytes,Number of bytes in messages processed by Raft.,,Sum,STRING(3)
raft_rcvd_dropped_bytes,Bytes of dropped incoming Raft messages,,Sum,STRING(3)
raft_rcvd_appresp,Number of MsgAppResp messages received by this store,,Sum,STRING(3)
raft_rcvd_prevote,Number of MsgPreVote messages received by this store,,Sum,STRING(3)
raft_rcvd_dropped,Number of incoming Raft messages dropped (due to queue length or size),,Sum,STRING(3)
raft_rcvd_snap,Number of MsgSnap messages received by this store,,Sum,STRING(3)
txn_refresh_auto_retries,Number of request retries after successful refreshes,,Sum,
txn_restarts_writetooold,Number of restarts due to a concurrent writer committing first,,Sum,
txn_refresh_fail,Number of failed transaction refreshes,,Sum,
txn_restarts_asyncwritefailure,Number of restarts due to async consensus writes that failed to leave intents,,Sum,
txn_restarts_readwithinuncertainty,Number of restarts due to reading a new value within the uncertainty interval,,Sum,
txn_refresh_success,"Number of successful transaction refreshes. A refresh may be preemptive or reactive. A reactive refresh is performed after a request throws an error because a refresh is needed for it to succeed. In these cases, the request will be re-issued as an auto-retry (see txn.refresh.auto_retries) after the refresh succeeds.",,Sum,
txn_restarts_serializable,Number of restarts due to a forwarded commit timestamp and isolation=SERIALIZABLE,,Sum,
txn_restarts_txnaborted,Number of restarts due to an abort by a concurrent transaction (usually due to deadlock),,Sum,
txn_refresh_fail_with_condensed_spans,"Number of failed refreshes for transactions whose read tracking lost fidelity because of condensing. Such a failure could be a false conflict. Failures counted here are also counted in txn.refresh.fail, and the respective transactions are also counted in txn.refresh.memory_limit_exceeded.",,Sum,
txn_restarts_commitdeadlineexceeded,Number of restarts due to a transaction exceeding its deadline,,Sum,
txn_restarts,Number of restarted KV transactions,,Histogram,
txn_restarts_txnpush,Number of restarts due to a transaction push failure,,Sum,
txn_restarts_unknown,Number of restarts due to a unknown reasons,,Sum,
txn_refresh_memory_limit_exceeded,"Number of transaction which exceed the refresh span bytes limit, causing their read spans to be condensed",,Sum,
txn_restarts_writetoooldmulti,Number of restarts due to multiple concurrent writers committing first,,Sum,
sql_guardrails_transaction_rows_written_err_count_internal,Number of transactions errored because of transaction_rows_written_err guardrail (internal queries),,Sum,
sql_guardrails_transaction_rows_read_err_count_internal,Number of transactions errored because of transaction_rows_read_err guardrail (internal queries),,Sum,
sql_guardrails_transaction_rows_read_log_count,Number of transactions logged because of transaction_rows_read_log guardrail,,Sum,
sql_guardrails_max_row_size_log_count_internal,Number of rows observed violating sql.guardrails.max_row_size_log (internal queries),,Sum,
sql_guardrails_transaction_rows_written_log_count_internal,Number of transactions logged because of transaction_rows_written_log guardrail (internal queries),,Sum,
sql_guardrails_full_scan_rejected_count_internal,Number of full table or index scans that have been rejected because of `disallow_full_table_scans` guardrail (internal queries),,Sum,
sql_guardrails_transaction_rows_read_log_count_internal,Number of transactions logged because of transaction_rows_read_log guardrail (internal queries),,Sum,
sql_guardrails_transaction_rows_read_err_count,Number of transactions errored because of transaction_rows_read_err guardrail,,Sum,
sql_guardrails_max_row_size_err_count_internal,Number of rows observed violating sql.guardrails.max_row_size_err (internal queries),,Sum,
sql_guardrails_full_scan_rejected_count,Number of full table or index scans that have been rejected because of `disallow_full_table_scans` guardrail,,Sum,
sql_guardrails_max_row_size_log_count,Number of rows observed violating sql.guardrails.max_row_size_log,,Sum,
sql_guardrails_transaction_rows_written_err_count,Number of transactions errored because of transaction_rows_written_err guardrail,,Sum,
sql_guardrails_max_row_size_err_count,Number of rows observed violating sql.guardrails.max_row_size_err,,Sum,
sql_guardrails_transaction_rows_written_log_count,Number of transactions logged because of transaction_rows_written_log guardrail,,Sum,
sys_host_net_recv_bytes,Bytes received on all network interfaces since this process started,,Gauge,
sys_host_disk_iopsinprogress,IO operations currently in progress on this host,,Gauge,
sys_host_disk_read_time,Time spent reading from all disks since this process started,,Gauge,
sys_host_net_send_packets,Packets sent on all network interfaces since this process started,,Gauge,
sys_host_disk_weightedio_time,Weighted time spent reading from or writing to to all disks since this process started,,Gauge,
sys_host_disk_write_count,Disk write operations across all disks since this process started,,Gauge,
sys_host_net_recv_packets,Packets received on all network interfaces since this process started,,Gauge,
sys_host_disk_write_bytes,Bytes written to all disks since this process started,,Gauge,
sys_host_disk_read_bytes,Bytes read from all disks since this process started,,Gauge,
sys_host_disk_write_time,Time spent writing to all disks since this process started,,Gauge,
sys_host_disk_read_count,Disk read operations across all disks since this process started,,Gauge,
sys_host_net_send_bytes,Bytes sent on all network interfaces since this process started,,Gauge,
sys_host_disk_io_time,Time spent reading from or writing to all disks since this process started,,Gauge,
kv_protectedts_reconciliation_records_removed,number of records removed during reconciliation runs on this node,,Sum,
kv_prober_read_failures,"Number of attempts made to read probe KV that failed, whether due to error or timeout",,Sum,
kv_protectedts_reconciliation_errors,number of errors encountered during reconciliation runs on this node,,Sum,
kv_prober_read_latency,Latency of successful KV read probes,,Histogram,
kv_prober_write_quarantine_oldest_duration,The duration that the oldest range in the write quarantine pool has remained,,Gauge,
kv_protectedts_reconciliation_records_processed,number of records processed without error during reconciliation on this node,,Sum,
kv_prober_read_attempts,"Number of attempts made to read probe KV, regardless of outcome",,Sum,
kv_prober_planning_failures,"Number of attempts at planning out probes that failed; in order to probe KV we need to plan out which ranges to probe; if planning fails, then kvprober is not able to send probes to all ranges; consider alerting on this metric as a result",,Sum,
kv_prober_write_failures,"Number of attempts made to write probe KV that failed, whether due to error or timeout",,Sum,
kv_prober_write_attempts,"Number of attempts made to write probe KV, regardless of outcome",,Sum,
kv_prober_write_latency,Latency of successful KV write probes,,Histogram,
kv_protectedts_reconciliation_num_runs,number of successful reconciliation runs on this node,,Sum,
kv_prober_planning_attempts,Number of attempts at planning out probes made; in order to probe KV we need to plan out which ranges to probe;,,Sum,
streaming_running,Number of currently running replication streams,,Gauge,
streaming_flush_hist_nanos,Time spent flushing messages across all replication streams,,Histogram,
streaming_admit_latency,Description: Event admission latency: a difference between event MVCC timestamp and the time it was admitted into ingestion processor,,Histogram,
streaming_flushes,Total flushes across all ingestion jobs,,Sum,
streaming_resolved_events_ingested,Resolved events ingested by all ingestion jobs,,Sum,
streaming_data_checkpoint_span_count,The number of resolved spans in the last checkpoint forwarded by an ingestion data processor,,Gauge,
streaming_frontier_checkpoint_span_count,The number of resolved spans last persisted to the ingestion job's checkpoint record,,Gauge,
streaming_events_ingested,Events ingested by all ingestion jobs,,Sum,
streaming_latest_data_checkpoint_span,The latest timestamp of the last checkpoint forwarded by an ingestion data processor,,Gauge,
streaming_commit_latency,"Description: Event commit latency: a difference between event MVCC timestamp and the time it was flushed into disk. If we batch events, then the difference between the oldest event in the batch and flush is recorded",,Histogram,
streaming_earliest_data_checkpoint_span,The earliest timestamp of the last checkpoint forwarded by an ingestion data processor,,Gauge,
streaming_job_progress_updates,Total number of updates to the ingestion job progress,,Sum,
streaming_ingested_bytes,Bytes ingested by all ingestion jobs,,Sum,
sql_restart_savepoint_rollback_count_internal,Number of `ROLLBACK TO SAVEPOINT cockroach_restart` statements successfully executed (internal queries),,Sum,
sql_restart_savepoint_release_count,Number of `RELEASE SAVEPOINT cockroach_restart` statements successfully executed,,Sum,
sql_restart_savepoint_release_count_internal,Number of `RELEASE SAVEPOINT cockroach_restart` statements successfully executed (internal queries),,Sum,
sql_restart_savepoint_release_started_count_internal,Number of `RELEASE SAVEPOINT cockroach_restart` statements started (internal queries),,Sum,
sql_restart_savepoint_started_count,Number of `SAVEPOINT cockroach_restart` statements started,,Sum,
sql_restart_savepoint_rollback_started_count_internal,Number of `ROLLBACK TO SAVEPOINT cockroach_restart` statements started (internal queries),,Sum,
sql_restart_savepoint_rollback_count,Number of `ROLLBACK TO SAVEPOINT cockroach_restart` statements successfully executed,,Sum,
sql_restart_savepoint_count_internal,Number of `SAVEPOINT cockroach_restart` statements successfully executed (internal queries),,Sum,
sql_restart_savepoint_release_started_count,Number of `RELEASE SAVEPOINT cockroach_restart` statements started,,Sum,
sql_restart_savepoint_count,Number of `SAVEPOINT cockroach_restart` statements successfully executed,,Sum,
sql_restart_savepoint_rollback_started_count,Number of `ROLLBACK TO SAVEPOINT cockroach_restart` statements started,,Sum,
sql_restart_savepoint_started_count_internal,Number of `SAVEPOINT cockroach_restart` statements started (internal queries),,Sum,
sql_stats_reported_mem_current,Current memory usage for reported fingerprint storage,,Gauge,
sql_statements_active_internal,Number of currently active user SQL statements (internal queries),,Gauge,
sql_stats_mem_max,Memory usage for fingerprint storage,,Histogram,
sql_stats_flush_count,Number of times SQL Stats are flushed to persistent storage,,Sum,
sql_stats_txn_stats_collection_duration,Time took in nanoseconds to collect transaction stats,,Histogram,
sql_statements_active,Number of currently active user SQL statements,,Gauge,
sql_stats_discarded_current,Number of fingerprint statistics being discarded,,Sum,
sql_stats_cleanup_rows_removed,Number of stale statistics rows that are removed,,Sum,
sql_stats_flush_duration,Time took to in nanoseconds to complete SQL Stats flush,,Histogram,
sql_stats_reported_mem_max,Memory usage for reported fingerprint storage,,Histogram,
sql_stats_mem_current,Current memory usage for fingerprint storage,,Gauge,
sql_stats_flush_error,Number of errors encountered when flushing SQL Stats,,Sum,
tenant_consumption_read_bytes,Total number of bytes read from KV,,Gauge,
tenant_consumption_write_requests,Total number of KV write requests,,Gauge,
tenant_consumption_kv_request_units,RU consumption attributable to KV,,Gauge,
tenant_consumption_pgwire_egress_bytes,Total number of bytes transferred from a SQL pod to the client,,Gauge,
tenant_consumption_external_io_ingress_bytes,Total number of bytes read from external services such as cloud storage providers,,Gauge,
tenant_consumption_external_io_egress_bytes,Total number of bytes written to external services such as cloud storage providers,,Gauge,
tenant_consumption_write_batches,Total number of KV write batches,,Gauge,
tenant_consumption_write_bytes,Total number of bytes written to KV,,Gauge,
tenant_consumption_sql_pods_cpu_seconds,Total amount of CPU used by SQL pods,,Gauge,
tenant_consumption_request_units,Total RU consumption,,Gauge,
tenant_consumption_read_requests,Total number of KV read requests,,Gauge,
tenant_consumption_read_batches,Total number of KV read batches,,Gauge,
sql_savepoint_rollback_started_count,Number of `ROLLBACK TO SAVEPOINT` statements started,,Sum,
sql_savepoint_release_started_count_internal,Number of `RELEASE SAVEPOINT` statements started (internal queries),,Sum,
sql_savepoint_count,Number of SQL SAVEPOINT statements successfully executed,,Sum,
sql_savepoint_rollback_count_internal,Number of `ROLLBACK TO SAVEPOINT` statements successfully executed (internal queries),,Sum,
sql_savepoint_rollback_started_count_internal,Number of `ROLLBACK TO SAVEPOINT` statements started (internal queries),,Sum,
sql_savepoint_release_count,Number of `RELEASE SAVEPOINT` statements successfully executed,,Sum,
sql_savepoint_release_started_count,Number of `RELEASE SAVEPOINT` statements started,,Sum,
sql_savepoint_rollback_count,Number of `ROLLBACK TO SAVEPOINT` statements successfully executed,,Sum,
sql_savepoint_count_internal,Number of SQL SAVEPOINT statements successfully executed (internal queries),,Sum,
sql_savepoint_started_count,Number of SQL SAVEPOINT statements started,,Sum,
sql_savepoint_release_count_internal,Number of `RELEASE SAVEPOINT` statements successfully executed (internal queries),,Sum,
sql_savepoint_started_count_internal,Number of SQL SAVEPOINT statements started (internal queries),,Sum,
