Name,Description,Unit,DataType,Attributes
admission_io_overload,1-normalized float indicating whether IO admission control considers the store as overloaded with respect to compaction out of L0 (considers sub-level and file counts).,,Gauge,STRING(3)
admission_errored_sql_kv_response,Number of requests not admitted due to error,,Sum,
admission_granter_slot_adjuster_increments_kv,Number of increments of the total KV slots,,Sum,
admission_granter_cpu_load_long_period_duration_kv,"Total duration when CPULoad was being called with a long period, in micros",,Sum,
admission_wait_queue_length_sql_kv_response,Length of wait queue,,Gauge,
admission_wait_durations_sql_kv_response,Wait time durations for requests that waited,,Histogram,
rpc_method_migrate_recv,Number of Migrate requests processed,,Sum,
rpc_method_barrier_recv,Number of Barrier requests processed,,Sum,
rpc_method_pushtxn_recv,Number of PushTxn requests processed,,Sum,
rpc_method_adminsplit_recv,Number of AdminSplit requests processed,,Sum,
rpc_method_resolveintentrange_recv,Number of ResolveIntentRange requests processed,,Sum,
rpc_method_scan_recv,Number of Scan requests processed,,Sum,
rpc_method_admintransferlease_recv,Number of AdminTransferLease requests processed,,Sum,
rpc_method_addsstable_recv,Number of AddSSTable requests processed,,Sum,
rpc_method_computechecksum_recv,Number of ComputeChecksum requests processed,,Sum,
rpc_method_adminrelocaterange_recv,Number of AdminRelocateRange requests processed,,Sum,
rpc_method_isspanempty_recv,Number of IsSpanEmpty requests processed,,Sum,
rpc_method_leaseinfo_recv,Number of LeaseInfo requests processed,,Sum,
rpc_method_recomputestats_recv,Number of RecomputeStats requests processed,,Sum,
rpc_method_probe_recv,Number of Probe requests processed,,Sum,
rpc_method_adminscatter_recv,Number of AdminScatter requests processed,,Sum,
rpc_method_adminverifyprotectedtimestamp_recv,Number of AdminVerifyProtectedTimestamp requests processed,,Sum,
rpc_method_transferlease_recv,Number of TransferLease requests processed,,Sum,
rpc_method_adminmerge_recv,Number of AdminMerge requests processed,,Sum,
rpc_method_conditionalput_recv,Number of ConditionalPut requests processed,,Sum,
rpc_method_deleterange_recv,Number of DeleteRange requests processed,,Sum,
rpc_method_heartbeattxn_recv,Number of HeartbeatTxn requests processed,,Sum,
rpc_method_gc_recv,Number of GC requests processed,,Sum,
rpc_method_subsume_recv,Number of Subsume requests processed,,Sum,
rpc_method_adminchangereplicas_recv,Number of AdminChangeReplicas requests processed,,Sum,
rpc_method_checkconsistency_recv,Number of CheckConsistency requests processed,,Sum,
rpc_method_refreshrange_recv,Number of RefreshRange requests processed,,Sum,
rpc_method_increment_recv,Number of Increment requests processed,,Sum,
rpc_method_rangestats_recv,Number of RangeStats requests processed,,Sum,
rpc_method_reversescan_recv,Number of ReverseScan requests processed,,Sum,
rpc_method_merge_recv,Number of Merge requests processed,,Sum,
rpc_method_scaninterleavedintents_recv,Number of ScanInterleavedIntents requests processed,,Sum,
rpc_method_delete_recv,Number of Delete requests processed,,Sum,
rpc_method_export_recv,Number of Export requests processed,,Sum,
rpc_method_endtxn_recv,Number of EndTxn requests processed,,Sum,
rpc_method_resolveintent_recv,Number of ResolveIntent requests processed,,Sum,
rpc_method_revertrange_recv,Number of RevertRange requests processed,,Sum,
rpc_method_querytxn_recv,Number of QueryTxn requests processed,,Sum,
rpc_method_recovertxn_recv,Number of RecoverTxn requests processed,,Sum,
rpc_method_truncatelog_recv,Number of TruncateLog requests processed,,Sum,
rpc_method_adminunsplit_recv,Number of AdminUnsplit requests processed,,Sum,
rpc_method_put_recv,Number of Put requests processed,,Sum,
rpc_method_get_recv,Number of Get requests processed,,Sum,
rpc_method_queryintent_recv,Number of QueryIntent requests processed,,Sum,
rpc_method_queryresolvedtimestamp_recv,Number of QueryResolvedTimestamp requests processed,,Sum,
rpc_method_querylocks_recv,Number of QueryLocks requests processed,,Sum,
rpc_method_requestlease_recv,Number of RequestLease requests processed,,Sum,
rpc_method_refresh_recv,Number of Refresh requests processed,,Sum,
rpc_method_clearrange_recv,Number of ClearRange requests processed,,Sum,
rpc_method_initput_recv,Number of InitPut requests processed,,Sum,
rpc_method_writebatch_recv,Number of WriteBatch requests processed,,Sum,
changefeed_emitted_bytes,Bytes emitted by all feeds,,Sum,
changefeed_buffer_entries_released,"Total entries processed, emitted and acknowledged by the sinks",,Sum,
changefeed_buffer_entries_mem_released,Total amount of memory released by the entries after they have been emitted,,Sum,
changefeed_flushes,Total flushes across all feeds,,Sum,
changefeed_failures,Total number of changefeed jobs which have failed,,Sum,
changefeed_schema_registry_registrations,Number of registration attempts with the schema registry,,Sum,
changefeed_size_based_flushes,Total size based flushes across all feeds,,Sum,
changefeed_buffer_pushback_nanos,Total time spent waiting while the buffer was full,,Sum,
changefeed_forwarded_resolved_messages,Resolved timestamps forwarded from the change aggregator to the change frontier,,Sum,
changefeed_running,"Number of currently running changefeeds, including sinkless",,Gauge,
changefeed_backfill_pending_ranges,Number of ranges in an ongoing backfill that are yet to be fully emitted,,Gauge,
changefeed_replan_count,Number of replans triggered across all feeds,,Sum,
changefeed_checkpoint_hist_nanos,Time spent checkpointing changefeed progress,,Histogram,
changefeed_buffer_entries_out,Total entries leaving the buffer between raft and changefeed sinks,,Sum,
changefeed_bytes_messages_pushback_nanos,Total time spent throttled for bytes quota,,Sum,
changefeed_error_retries,Total retryable errors encountered by all changefeeds,,Sum,
changefeed_buffer_entries_in,Total entries entering the buffer between raft and changefeed sinks,,Sum,
changefeed_sink_batch_hist_nanos,Time spent batched in the sink buffer before being flushed and acknowledged,,Histogram,
changefeed_table_metadata_nanos,Time blocked while verifying table metadata histories,,Sum,
changefeed_commit_latency,"Description: Event commit latency: a difference between event MVCC timestamp and the time it was acknowledged by the downstream sink.  If the sink batches events,  then the difference between the oldest event in the batch and acknowledgement is recorded; Excludes latency during backfill",,Histogram,
changefeed_nprocs_in_flight_count,Number of buffered events in the parallel consumer,,Gauge,
changefeed_backfill_count,Number of changefeeds currently executing backfill,,Gauge,
changefeed_message_size_hist,Message size histogram,,Histogram,
changefeed_flush_hist_nanos,Time spent flushing messages across all changefeeds,,Histogram,
changefeed_queue_time_nanos,Time KV event spent waiting to be processed,,Sum,
changefeed_buffer_entries_mem_acquired,Total amount of memory acquired for entries as they enter the system,,Sum,
changefeed_admit_latency,"Description: Event admission latency: a difference between event MVCC timestamp and the time it was admitted into changefeed pipeline; Note: this metric includes the time spent waiting until event can be processed due to backpressure or time spent resolving schema descriptors. Also note, this metric excludes latency during backfill",,Histogram,
changefeed_schema_registry_retry_count,Number of retries encountered when sending requests to the schema registry,,Sum,
changefeed_messages_messages_pushback_nanos,Total time spent throttled for messages quota,,Sum,
changefeed_nprocs_flush_nanos,Total time spent idle waiting for the parallel consumer to flush,,Sum,
changefeed_internal_retry_message_count,Number of messages for which an attempt to retry them within an aggregator node was made,,Gauge,
changefeed_frontier_updates,Number of change frontier updates across all feeds,,Sum,
changefeed_batch_reduction_count,Number of times a changefeed aggregator node attempted to reduce the size of message batches it emitted to the sink,,Gauge,
changefeed_max_behind_nanos,Largest commit-to-emit duration of any running feed,,Gauge,
changefeed_emitted_messages,Messages emitted by all feeds,,Sum,
changefeed_nprocs_consume_event_nanos,Total time spent waiting to add an event to the parallel consumer,,Sum,
changefeed_flushed_bytes,Bytes emitted by all feeds; maybe different from changefeed.emitted_bytes when compression is enabled,,Sum,
changefeed_flush_messages_pushback_nanos,Total time spent throttled for flush quota,,Sum,
jobs_auto_create_stats_resume_retry_error,Number of auto_create_stats jobs which failed with a retriable error,,Sum,
jobs_auto_create_stats_fail_or_cancel_retry_error,Number of auto_create_stats jobs which failed with a retriable error on their failure or cancelation process,,Sum,
jobs_auto_sql_stats_compaction_fail_or_cancel_retry_error,Number of auto_sql_stats_compaction jobs which failed with a retriable error on their failure or cancelation process,,Sum,
jobs_auto_schema_telemetry_resume_completed,Number of auto_schema_telemetry jobs which successfully resumed to completion,,Sum,
jobs_auto_sql_stats_compaction_fail_or_cancel_failed,Number of auto_sql_stats_compaction jobs which failed with a non-retriable error on their failure or cancelation process,,Sum,
jobs_auto_sql_stats_compaction_resume_retry_error,Number of auto_sql_stats_compaction jobs which failed with a retriable error,,Sum,
jobs_auto_create_stats_currently_running,Number of auto_create_stats jobs currently running in Resume or OnFailOrCancel state,,Gauge,
jobs_auto_sql_stats_compaction_currently_running,Number of auto_sql_stats_compaction jobs currently running in Resume or OnFailOrCancel state,,Gauge,
jobs_auto_create_stats_currently_idle,Number of auto_create_stats jobs currently considered Idle and can be freely shut down,,Gauge,
jobs_adopt_iterations,number of job-adopt iterations performed by the registry,,Sum,
jobs_auto_span_config_reconciliation_resume_completed,Number of auto_span_config_reconciliation jobs which successfully resumed to completion,,Sum,
jobs_auto_sql_stats_compaction_fail_or_cancel_completed,Number of auto_sql_stats_compaction jobs which successfully completed their failure or cancelation process,,Sum,
jobs_auto_create_stats_resume_failed,Number of auto_create_stats jobs which failed with a non-retriable error,,Sum,
jobs_auto_create_stats_fail_or_cancel_failed,Number of auto_create_stats jobs which failed with a non-retriable error on their failure or cancelation process,,Sum,
jobs_auto_span_config_reconciliation_resume_retry_error,Number of auto_span_config_reconciliation jobs which failed with a retriable error,,Sum,
jobs_auto_create_stats_resume_completed,Number of auto_create_stats jobs which successfully resumed to completion,,Sum,
jobs_auto_sql_stats_compaction_currently_idle,Number of auto_sql_stats_compaction jobs currently considered Idle and can be freely shut down,,Gauge,
jobs_auto_schema_telemetry_resume_retry_error,Number of auto_schema_telemetry jobs which failed with a retriable error,,Sum,
jobs_auto_schema_telemetry_currently_running,Number of auto_schema_telemetry jobs currently running in Resume or OnFailOrCancel state,,Gauge,
jobs_auto_span_config_reconciliation_fail_or_cancel_failed,Number of auto_span_config_reconciliation jobs which failed with a non-retriable error on their failure or cancelation process,,Sum,
jobs_auto_schema_telemetry_fail_or_cancel_retry_error,Number of auto_schema_telemetry jobs which failed with a retriable error on their failure or cancelation process,,Sum,
jobs_auto_span_config_reconciliation_resume_failed,Number of auto_span_config_reconciliation jobs which failed with a non-retriable error,,Sum,
jobs_auto_schema_telemetry_fail_or_cancel_failed,Number of auto_schema_telemetry jobs which failed with a non-retriable error on their failure or cancelation process,,Sum,
jobs_auto_span_config_reconciliation_fail_or_cancel_completed,Number of auto_span_config_reconciliation jobs which successfully completed their failure or cancelation process,,Sum,
jobs_auto_schema_telemetry_resume_failed,Number of auto_schema_telemetry jobs which failed with a non-retriable error,,Sum,
jobs_auto_span_config_reconciliation_fail_or_cancel_retry_error,Number of auto_span_config_reconciliation jobs which failed with a retriable error on their failure or cancelation process,,Sum,
jobs_auto_span_config_reconciliation_currently_idle,Number of auto_span_config_reconciliation jobs currently considered Idle and can be freely shut down,,Gauge,
jobs_auto_schema_telemetry_currently_idle,Number of auto_schema_telemetry jobs currently considered Idle and can be freely shut down,,Gauge,
jobs_auto_schema_telemetry_fail_or_cancel_completed,Number of auto_schema_telemetry jobs which successfully completed their failure or cancelation process,,Sum,
jobs_auto_create_stats_fail_or_cancel_completed,Number of auto_create_stats jobs which successfully completed their failure or cancelation process,,Sum,
jobs_auto_span_config_reconciliation_currently_running,Number of auto_span_config_reconciliation jobs currently running in Resume or OnFailOrCancel state,,Gauge,
jobs_auto_sql_stats_compaction_resume_completed,Number of auto_sql_stats_compaction jobs which successfully resumed to completion,,Sum,
jobs_auto_sql_stats_compaction_resume_failed,Number of auto_sql_stats_compaction jobs which failed with a non-retriable error,,Sum,
jobs_schema_change_resume_completed,Number of schema_change jobs which successfully resumed to completion,,Sum,
jobs_stream_replication_currently_running,Number of stream_replication jobs currently running in Resume or OnFailOrCancel state,,Gauge,
jobs_schema_change_gc_resume_retry_error,Number of schema_change_gc jobs which failed with a retriable error,,Sum,
jobs_schema_change_gc_resume_completed,Number of schema_change_gc jobs which successfully resumed to completion,,Sum,
jobs_stream_replication_fail_or_cancel_failed,Number of stream_replication jobs which failed with a non-retriable error on their failure or cancelation process,,Sum,
jobs_schema_change_gc_fail_or_cancel_failed,Number of schema_change_gc jobs which failed with a non-retriable error on their failure or cancelation process,,Sum,
jobs_schema_change_gc_fail_or_cancel_completed,Number of schema_change_gc jobs which successfully completed their failure or cancelation process,,Sum,
jobs_schema_change_gc_currently_idle,Number of schema_change_gc jobs currently considered Idle and can be freely shut down,,Gauge,
jobs_schema_change_fail_or_cancel_failed,Number of schema_change jobs which failed with a non-retriable error on their failure or cancelation process,,Sum,
jobs_stream_replication_fail_or_cancel_retry_error,Number of stream_replication jobs which failed with a retriable error on their failure or cancelation process,,Sum,
jobs_stream_ingestion_fail_or_cancel_retry_error,Number of stream_ingestion jobs which failed with a retriable error on their failure or cancelation process,,Sum,
jobs_stream_replication_resume_failed,Number of stream_replication jobs which failed with a non-retriable error,,Sum,
jobs_stream_replication_resume_retry_error,Number of stream_replication jobs which failed with a retriable error,,Sum,
jobs_schema_change_fail_or_cancel_completed,Number of schema_change jobs which successfully completed their failure or cancelation process,,Sum,
jobs_schema_change_gc_currently_running,Number of schema_change_gc jobs currently running in Resume or OnFailOrCancel state,,Gauge,
jobs_stream_ingestion_resume_completed,Number of stream_ingestion jobs which successfully resumed to completion,,Sum,
jobs_stream_ingestion_resume_failed,Number of stream_ingestion jobs which failed with a non-retriable error,,Sum,
jobs_schema_change_gc_fail_or_cancel_retry_error,Number of schema_change_gc jobs which failed with a retriable error on their failure or cancelation process,,Sum,
jobs_schema_change_currently_running,Number of schema_change jobs currently running in Resume or OnFailOrCancel state,,Gauge,
jobs_schema_change_currently_idle,Number of schema_change jobs currently considered Idle and can be freely shut down,,Gauge,
jobs_schema_change_resume_retry_error,Number of schema_change jobs which failed with a retriable error,,Sum,
jobs_schema_change_gc_resume_failed,Number of schema_change_gc jobs which failed with a non-retriable error,,Sum,
jobs_stream_ingestion_currently_idle,Number of stream_ingestion jobs currently considered Idle and can be freely shut down,,Gauge,
jobs_stream_replication_resume_completed,Number of stream_replication jobs which successfully resumed to completion,,Sum,
jobs_stream_ingestion_fail_or_cancel_failed,Number of stream_ingestion jobs which failed with a non-retriable error on their failure or cancelation process,,Sum,
jobs_stream_ingestion_fail_or_cancel_completed,Number of stream_ingestion jobs which successfully completed their failure or cancelation process,,Sum,
jobs_stream_ingestion_resume_retry_error,Number of stream_ingestion jobs which failed with a retriable error,,Sum,
jobs_schema_change_fail_or_cancel_retry_error,Number of schema_change jobs which failed with a retriable error on their failure or cancelation process,,Sum,
jobs_schema_change_resume_failed,Number of schema_change jobs which failed with a non-retriable error,,Sum,
jobs_stream_ingestion_currently_running,Number of stream_ingestion jobs currently running in Resume or OnFailOrCancel state,,Gauge,
jobs_stream_replication_currently_idle,Number of stream_replication jobs currently considered Idle and can be freely shut down,,Gauge,
jobs_stream_replication_fail_or_cancel_completed,Number of stream_replication jobs which successfully completed their failure or cancelation process,,Sum,
storage_write_stalls,Number of instances of intentional write stalls to backpressure incoming writes,,Gauge,STRING(3)
storage_l0_bytes_ingested,Number of bytes ingested directly into Level 0,,Gauge,STRING(3)
storage_l2_level_size,Size of the SSTables in level 2,,Gauge,STRING(3)
storage_l0_bytes_flushed,Number of bytes flushed (from memtables) into Level 0,,Gauge,STRING(3)
storage_l1_level_score,Compaction score of level 1,,Gauge,STRING(3)
storage_l6_level_score,Compaction score of level 6,,Gauge,STRING(3)
storage_l3_bytes_ingested,Number of bytes ingested directly into Level 3,,Gauge,STRING(3)
storage_l1_level_size,Size of the SSTables in level 1,,Gauge,STRING(3)
storage_l5_level_size,Size of the SSTables in level 5,,Gauge,STRING(3)
storage_l0_sublevels,Number of Level 0 sublevels,,Gauge,STRING(3)
storage_l6_bytes_ingested,Number of bytes ingested directly into Level 6,,Gauge,STRING(3)
storage_disk_slow,Number of instances of disk operations taking longer than 10s,,Gauge,STRING(3)
storage_l0_level_size,Size of the SSTables in level 0,,Gauge,STRING(3)
storage_l4_level_score,Compaction score of level 4,,Gauge,STRING(3)
storage_l1_bytes_ingested,Number of bytes ingested directly into Level 1,,Gauge,STRING(3)
storage_l3_level_size,Size of the SSTables in level 3,,Gauge,STRING(3)
storage_l4_level_size,Size of the SSTables in level 4,,Gauge,STRING(3)
storage_disk_stalled,Number of instances of disk operations taking longer than 30s,,Gauge,STRING(3)
storage_l2_bytes_ingested,Number of bytes ingested directly into Level 2,,Gauge,STRING(3)
storage_l0_num_files,Number of SSTables in Level 0,,Gauge,STRING(3)
storage_l0_level_score,Compaction score of level 0,,Gauge,STRING(3)
storage_l6_level_size,Size of the SSTables in level 6,,Gauge,STRING(3)
storage_l5_level_score,Compaction score of level 5,,Gauge,STRING(3)
storage_l2_level_score,Compaction score of level 2,,Gauge,STRING(3)
storage_write_stall_nanos,Total write stall duration in nanos,,Gauge,STRING(3)
storage_keys_range_key_set_count,Approximate count of RangeKeySet internal keys across the storage engine.,,Gauge,STRING(3)
storage_marked_for_compaction_files,Count of SSTables marked for compaction,,Gauge,STRING(3)
storage_l4_bytes_ingested,Number of bytes ingested directly into Level 4,,Gauge,STRING(3)
storage_l3_level_score,Compaction score of level 3,,Gauge,STRING(3)
storage_l5_bytes_ingested,Number of bytes ingested directly into Level 5,,Gauge,STRING(3)
jobs_row_level_ttl_fail_or_cancel_completed,Number of row_level_ttl jobs which successfully completed their failure or cancelation process,,Sum,
jobs_restore_fail_or_cancel_completed,Number of restore jobs which successfully completed their failure or cancelation process,,Sum,
jobs_row_level_ttl_rows_selected,Number of rows selected for deletion by the row level TTL job.,,Sum,
jobs_row_level_ttl_delete_duration,Duration for delete requests during row level TTL.,,Histogram,
jobs_resumed_claimed_jobs,number of claimed-jobs resumed in job-adopt iterations,,Sum,
jobs_restore_resume_retry_error,Number of restore jobs which failed with a retriable error,,Sum,
jobs_restore_resume_failed,Number of restore jobs which failed with a non-retriable error,,Sum,
jobs_restore_resume_completed,Number of restore jobs which successfully resumed to completion,,Sum,
jobs_restore_fail_or_cancel_retry_error,Number of restore jobs which failed with a retriable error on their failure or cancelation process,,Sum,
jobs_restore_currently_idle,Number of restore jobs currently considered Idle and can be freely shut down,,Gauge,
jobs_row_level_ttl_select_duration,Duration for select requests during row level TTL.,,Histogram,
jobs_row_level_ttl_total_expired_rows,Approximate number of rows that have expired the TTL on the TTL table.,,Gauge,
jobs_row_level_ttl_currently_running,Number of row_level_ttl jobs currently running in Resume or OnFailOrCancel state,,Gauge,
jobs_restore_currently_running,Number of restore jobs currently running in Resume or OnFailOrCancel state,,Gauge,
jobs_row_level_ttl_resume_failed,Number of row_level_ttl jobs which failed with a non-retriable error,,Sum,
jobs_row_level_ttl_currently_idle,Number of row_level_ttl jobs currently considered Idle and can be freely shut down,,Gauge,
jobs_row_level_ttl_resume_completed,Number of row_level_ttl jobs which successfully resumed to completion,,Sum,
jobs_restore_fail_or_cancel_failed,Number of restore jobs which failed with a non-retriable error on their failure or cancelation process,,Sum,
jobs_running_non_idle,number of running jobs that are not idle,,Gauge,
jobs_row_level_ttl_span_total_duration,Duration for processing a span during row level TTL.,,Histogram,
jobs_row_level_ttl_resume_retry_error,Number of row_level_ttl jobs which failed with a retriable error,,Sum,
jobs_row_level_ttl_fail_or_cancel_retry_error,Number of row_level_ttl jobs which failed with a retriable error on their failure or cancelation process,,Sum,
jobs_row_level_ttl_fail_or_cancel_failed,Number of row_level_ttl jobs which failed with a non-retriable error on their failure or cancelation process,,Sum,
jobs_row_level_ttl_total_rows,Approximate number of rows on the TTL table.,,Gauge,
jobs_row_level_ttl_rows_deleted,Number of rows deleted by the row level TTL job.,,Sum,
jobs_row_level_ttl_num_active_spans,Number of active spans the TTL job is deleting from.,,Gauge,
range_snapshots_recv_in_progress,Number of non-empty snapshots being received,,Gauge,STRING(3)
range_splits,Number of range splits,,Sum,STRING(3)
range_snapshots_rebalancing_sent_bytes,Number of rebalancing snapshot bytes sent,,Sum,STRING(3)
range_snapshots_send_in_progress,Number of non-empty snapshots being sent,,Gauge,STRING(3)
range_snapshots_generated,Number of generated snapshots,,Sum,STRING(3)
range_snapshots_applied_voter,Number of snapshots applied by voter replicas,,Sum,STRING(3)
range_snapshots_unknown_rcvd_bytes,Number of unknown snapshot bytes received,,Sum,STRING(3)
range_recoveries,Count of offline loss of quorum recovery operations performed on ranges.,,Sum,STRING(3)
range_removes,Number of range removals,,Sum,STRING(3)
range_snapshots_recovery_rcvd_bytes,Number of recovery snapshot bytes received,,Sum,STRING(3)
range_snapshots_rcvd_bytes,Number of snapshot bytes received,,Sum,STRING(3)
range_snapshots_send_queue,Number of snapshots queued to send,,Gauge,STRING(3)
range_snapshots_recv_total_in_progress,Number of total snapshots being received,,Gauge,STRING(3)
range_snapshots_recovery_sent_bytes,Number of recovery snapshot bytes sent,,Sum,STRING(3)
range_adds,Number of range additions,,Sum,STRING(3)
range_snapshots_rebalancing_rcvd_bytes,Number of rebalancing snapshot bytes received,,Sum,STRING(3)
range_snapshots_applied_initial,Number of snapshots applied for initial upreplication,,Sum,STRING(3)
range_raftleadertransfers,Number of raft leader transfers,,Sum,STRING(3)
range_merges,Number of range merges,,Sum,STRING(3)
range_snapshots_applied_non_voter,Number of snapshots applied by non-voter replicas,,Sum,STRING(3)
range_snapshots_unknown_sent_bytes,Number of unknown snapshot bytes sent,,Sum,STRING(3)
range_snapshots_recv_queue,Number of snapshots queued to receive,,Gauge,STRING(3)
range_snapshots_send_total_in_progress,Number of total snapshots being sent,,Gauge,STRING(3)
range_snapshots_sent_bytes,Number of snapshot bytes sent,,Sum,STRING(3)
sql_txn_begin_started_count,Number of SQL transaction BEGIN statements started,,Sum,
sql_txn_rollback_count_internal,Number of SQL transaction ROLLBACK statements successfully executed (internal queries),,Sum,
sql_txn_rollback_count,Number of SQL transaction ROLLBACK statements successfully executed,,Sum,
sql_txn_latency_internal,Latency of SQL transactions (internal queries),,Histogram,
sql_txn_commit_started_count_internal,Number of SQL transaction COMMIT statements started (internal queries),,Sum,
sql_txn_contended_count,Number of SQL transactions experienced contention,,Sum,
sql_txn_abort_count,Number of SQL transaction abort errors,,Sum,
sql_txn_commit_started_count,Number of SQL transaction COMMIT statements started,,Sum,
