Name,Description,Unit,DataType,Attributes
kv_allocator_load_based_lease_transfers_cannot_find_better_candidate,The number times the allocator determined that the lease was on the best possible replica,,Sum,STRING(3)
kv_allocator_load_based_lease_transfers_should_transfer,The number times the allocator determined that the lease should be transferred to another replica for better load distribution,,Sum,STRING(3)
kv_allocator_load_based_replica_rebalancing_missing_stats_for_existing_store,The number times the allocator was missing the qps stats for the existing store,,Sum,STRING(3)
kv_allocator_load_based_replica_rebalancing_cannot_find_better_candidate,The number times the allocator determined that the range was on the best possible stores,,Sum,STRING(3)
kv_allocator_load_based_lease_transfers_missing_stats_for_existing_stores,The number times the allocator was missing qps stats for the leaseholder,,Sum,STRING(3)
kv_allocator_load_based_replica_rebalancing_existing_not_overfull,The number times the allocator determined that none of the range's replicas were on overfull stores,,Sum,STRING(3)
kv_allocator_load_based_replica_rebalancing_delta_not_significant,The number times the allocator determined that the delta between an existing store and the best replacement candidate was not high enough,,Sum,STRING(3)
kv_allocator_load_based_lease_transfers_delta_not_significant,The number times the allocator determined that the delta between the existing store and the best candidate was not significant,,Sum,STRING(3)
kv_allocator_load_based_replica_rebalancing_should_transfer,The number times the allocator determined that the replica should be rebalanced to another store for better load distribution,,Sum,STRING(3)
kv_allocator_load_based_lease_transfers_existing_not_overfull,The number times the allocator determined that the lease was not on an overfull store,,Sum,STRING(3)
intentresolver_async_throttled,Number of intent resolution attempts not run asynchronously due to throttling,,Sum,STRING(3)
intents_abort_attempts,Count of (point or range) non-poisoning intent abort evaluation attempts,,Sum,STRING(3)
intentage,Cumulative age of intents,,Gauge,STRING(3)
intentresolver_finalized_txns_failed,Number of finalized transaction cleanup failures. Transaction cleanup refers to the process of resolving all of a transactions intents and then garbage collecting its transaction record.,,Sum,STRING(3)
intentbytes,Number of bytes in intent KV pairs,,Gauge,STRING(3)
intentcount,Count of intent keys,,Gauge,STRING(3)
intents_poison_attempts,Count of (point or range) poisoning intent abort evaluation attempts,,Sum,STRING(3)
intentresolver_intents_failed,"Number of intent resolution failures. The unit of measurement is a single intent, so if a batch of intent resolution requests fails, the metric will be incremented for each request in the batch.",,Sum,STRING(3)
intents_resolve_attempts,Count of (point or range) intent commit evaluation attempts,,Sum,STRING(3)
raft_timeoutcampaign,Number of Raft replicas campaigning after missed heartbeats from leader,,Sum,STRING(3)
raft_transport_sent,Number of Raft messages sent by the Raft Transport,,Sum,
raft_transport_send_queue_bytes,The total byte size of pending outgoing messages in the queue.,,Gauge,
raft_transport_sends_dropped,Number of Raft message sends dropped by the Raft Transport,,Sum,
raft_transport_reverse_sent,Messages sent in the reverse direction of a stream.,,Sum,
raft_ticks,Number of Raft ticks queued,,Sum,STRING(3)
raft_transport_reverse_rcvd,Messages received from the reverse direction of a stream.,,Sum,
raft_transport_rcvd,Number of Raft messages received by the Raft Transport,,Sum,
raft_transport_send_queue_size,Number of pending outgoing messages in the Raft Transport queue.,,Gauge,
replicas_uninitialized,"Number of uninitialized replicas, this does not include uninitialized replicas that can lie dormant in a persistent state.",,Gauge,STRING(3)
replicas,Number of replicas,,Gauge,STRING(3)
replicas_leaders_not_leaseholders,Number of replicas that are Raft leaders whose range lease is held by another store,,Gauge,STRING(3)
replicas_leaseholders,Number of lease holders,,Gauge,STRING(3)
replicas_leaders,Number of raft leaders,,Gauge,STRING(3)
replicas_leaders_invalid_lease,Number of replicas that are Raft leaders whose lease is invalid,,Gauge,STRING(3)
replicas_reserved,Number of replicas reserved for snapshots,,Gauge,STRING(3)
replicas_quiescent,Number of quiesced replicas,,Gauge,STRING(3)
kv_concurrency_lock_wait_queue_waiters,Number of requests actively waiting in a lock wait-queue,,Gauge,STRING(3)
kv_concurrency_max_lock_hold_duration_nanos,Maximum length of time any lock in a lock table is held. Does not include replicated locks (intents) that are not held in memory,,Gauge,STRING(3)
kv_concurrency_avg_lock_hold_duration_nanos,Average lock hold duration across locks currently held in lock tables. Does not include replicated locks (intents) that are not held in memory,,Gauge,STRING(3)
kv_concurrency_max_lock_wait_queue_waiters_for_lock,Maximum number of requests actively waiting in any single lock wait-queue,,Gauge,STRING(3)
kv_concurrency_locks_with_wait_queues,Number of active locks held in lock tables with active wait-queues,,Gauge,STRING(3)
kv_concurrency_avg_lock_wait_duration_nanos,Average lock wait duration across requests currently waiting in lock wait-queues,,Gauge,STRING(3)
kv_concurrency_locks,Number of active locks held in lock tables. Does not include replicated locks (intents) that are not held in memory,,Gauge,STRING(3)
kv_concurrency_max_lock_wait_duration_nanos,Maximum lock wait duration across requests currently waiting in lock wait-queues,,Gauge,STRING(3)
kv_tenant_rate_limit_num_tenants,Number of tenants currently being tracked,,Gauge,STRING(3)
kv_tenant_rate_limit_write_requests_admitted,Number of write requests admitted by the rate limiter,,Sum,STRING(3)
kv_tenant_rate_limit_read_batches_admitted,Number of read batches admitted by the rate limiter,,Sum,STRING(3)
kv_tenant_rate_limit_read_bytes_admitted,Number of read bytes admitted by the rate limiter,,Sum,STRING(3)
kv_tenant_rate_limit_read_requests_admitted,Number of read requests admitted by the rate limiter,,Sum,STRING(3)
kv_tenant_rate_limit_write_batches_admitted,Number of write batches admitted by the rate limiter,,Sum,STRING(3)
kv_tenant_rate_limit_write_bytes_admitted,Number of write bytes admitted by the rate limiter,,Sum,STRING(3)
kv_tenant_rate_limit_current_blocked,Number of requests currently blocked by the rate limiter,,Gauge,STRING(3)
jobs_new_schema_change_resume_failed,Number of new_schema_change jobs which failed with a non-retriable error,,Sum,
jobs_new_schema_change_currently_running,Number of new_schema_change jobs currently running in Resume or OnFailOrCancel state,,Gauge,
jobs_new_schema_change_resume_retry_error,Number of new_schema_change jobs which failed with a retriable error,,Sum,
jobs_new_schema_change_resume_completed,Number of new_schema_change jobs which successfully resumed to completion,,Sum,
jobs_new_schema_change_fail_or_cancel_failed,Number of new_schema_change jobs which failed with a non-retriable error on their failure or cancelation process,,Sum,
jobs_new_schema_change_fail_or_cancel_completed,Number of new_schema_change jobs which successfully completed their failure or cancelation process,,Sum,
jobs_new_schema_change_currently_idle,Number of new_schema_change jobs currently considered Idle and can be freely shut down,,Gauge,
jobs_new_schema_change_fail_or_cancel_retry_error,Number of new_schema_change jobs which failed with a retriable error on their failure or cancelation process,,Sum,
jobs_import_fail_or_cancel_completed,Number of import jobs which successfully completed their failure or cancelation process,,Sum,
jobs_import_resume_failed,Number of import jobs which failed with a non-retriable error,,Sum,
jobs_import_currently_running,Number of import jobs currently running in Resume or OnFailOrCancel state,,Gauge,
jobs_import_resume_retry_error,Number of import jobs which failed with a retriable error,,Sum,
jobs_import_fail_or_cancel_retry_error,Number of import jobs which failed with a retriable error on their failure or cancelation process,,Sum,
jobs_import_currently_idle,Number of import jobs currently considered Idle and can be freely shut down,,Gauge,
jobs_import_resume_completed,Number of import jobs which successfully resumed to completion,,Sum,
jobs_import_fail_or_cancel_failed,Number of import jobs which failed with a non-retriable error on their failure or cancelation process,,Sum,
jobs_migration_resume_retry_error,Number of migration jobs which failed with a retriable error,,Sum,
jobs_migration_resume_completed,Number of migration jobs which successfully resumed to completion,,Sum,
jobs_migration_currently_idle,Number of migration jobs currently considered Idle and can be freely shut down,,Gauge,
jobs_migration_resume_failed,Number of migration jobs which failed with a non-retriable error,,Sum,
jobs_migration_currently_running,Number of migration jobs currently running in Resume or OnFailOrCancel state,,Gauge,
jobs_migration_fail_or_cancel_completed,Number of migration jobs which successfully completed their failure or cancelation process,,Sum,
jobs_migration_fail_or_cancel_retry_error,Number of migration jobs which failed with a retriable error on their failure or cancelation process,,Sum,
jobs_migration_fail_or_cancel_failed,Number of migration jobs which failed with a non-retriable error on their failure or cancelation process,,Sum,
jobs_backup_resume_retry_error,Number of backup jobs which failed with a retriable error,,Sum,
jobs_backup_currently_running,Number of backup jobs currently running in Resume or OnFailOrCancel state,,Gauge,
jobs_backup_resume_failed,Number of backup jobs which failed with a non-retriable error,,Sum,
jobs_backup_currently_idle,Number of backup jobs currently considered Idle and can be freely shut down,,Gauge,
jobs_backup_fail_or_cancel_failed,Number of backup jobs which failed with a non-retriable error on their failure or cancelation process,,Sum,
jobs_backup_fail_or_cancel_completed,Number of backup jobs which successfully completed their failure or cancelation process,,Sum,
jobs_backup_fail_or_cancel_retry_error,Number of backup jobs which failed with a retriable error on their failure or cancelation process,,Sum,
jobs_backup_resume_completed,Number of backup jobs which successfully resumed to completion,,Sum,
jobs_typedesc_schema_change_fail_or_cancel_completed,Number of typedesc_schema_change jobs which successfully completed their failure or cancelation process,,Sum,
jobs_typedesc_schema_change_currently_idle,Number of typedesc_schema_change jobs currently considered Idle and can be freely shut down,,Gauge,
jobs_typedesc_schema_change_currently_running,Number of typedesc_schema_change jobs currently running in Resume or OnFailOrCancel state,,Gauge,
jobs_typedesc_schema_change_resume_failed,Number of typedesc_schema_change jobs which failed with a non-retriable error,,Sum,
jobs_typedesc_schema_change_fail_or_cancel_retry_error,Number of typedesc_schema_change jobs which failed with a retriable error on their failure or cancelation process,,Sum,
jobs_typedesc_schema_change_resume_completed,Number of typedesc_schema_change jobs which successfully resumed to completion,,Sum,
jobs_typedesc_schema_change_resume_retry_error,Number of typedesc_schema_change jobs which failed with a retriable error,,Sum,
jobs_typedesc_schema_change_fail_or_cancel_failed,Number of typedesc_schema_change jobs which failed with a non-retriable error on their failure or cancelation process,,Sum,
rebalancing_lease_transfers,Number of lease transfers motivated by store-level load imbalances,,Sum,STRING(3)
rebalancing_writebytespersecond,Average number of bytes read recently per second.,,Gauge,STRING(3)
rebalancing_readbytespersecond,Average number of bytes written recently per second.,,Gauge,STRING(3)
rebalancing_writespersecond,"Number of keys written (i.e. applied by raft) per second to the store, averaged over a large time period as used in rebalancing decisions",,Gauge,STRING(3)
rebalancing_requestspersecond,Average number of requests received recently per second.,,Gauge,STRING(3)
rebalancing_readspersecond,Average number of keys read recently per second.,,Gauge,STRING(3)
rebalancing_range_rebalances,Number of range rebalance operations motivated by store-level load imbalances,,Sum,STRING(3)
rebalancing_queriespersecond,"Number of kv-level requests received per second by the store, averaged over a large time period as used in rebalancing decisions",,Gauge,STRING(3)
txn_commits,Number of committed KV transactions (including 1PC),,Sum,
txn_condensed_intent_spans,KV transactions that have exceeded their intent tracking memory budget (kv.transaction.max_intents_bytes). See also txn.condensed_intent_spans_gauge for a gauge of such transactions currently running.,,Sum,
txn_condensed_intent_spans_rejected,KV transactions that have been aborted because they exceeded their intent tracking memory budget (kv.transaction.max_intents_bytes). Rejection is caused by kv.transaction.reject_over_max_intents_budget.,,Sum,
txn_condensed_intent_spans_gauge,KV transactions currently running that have exceeded their intent tracking memory budget (kv.transaction.max_intents_bytes). See also txn.condensed_intent_spans for a perpetual counter/rate.,,Gauge,
txn_commit_waits,Number of KV transactions that had to commit-wait on commit in order to ensure linearizability. This generally happens to transactions writing to global ranges.,,Sum,
txn_commit_waits_before_commit_trigger,Number of KV transactions that had to commit-wait on the server before committing because they had a commit trigger,,Sum,STRING(3)
txn_commits1PC,Number of KV transaction one-phase commit attempts,,Sum,
leases_requests_latency,"Lease request latency (all types and outcomes, coalesced)",,Histogram,STRING(3)
leases_transfers_success,Number of successful lease transfers,,Sum,STRING(3)
leases_success,Number of successful lease requests,,Sum,STRING(3)
leases_error,Number of failed lease requests,,Sum,STRING(3)
leases_epoch,Number of replica leaseholders using epoch-based leases,,Gauge,STRING(3)
leases_transfers_error,Number of failed lease transfers,,Sum,STRING(3)
leases_expiration,Number of replica leaseholders using expiration-based leases,,Gauge,STRING(3)
sql_insert_count_internal,Number of SQL INSERT statements successfully executed (internal queries),,Sum,
sql_insights_anomaly_detection_evictions,Evictions of fingerprint latency summaries due to memory pressure,,Sum,
sql_insights_anomaly_detection_memory,Current memory used to support anomaly detection,,Gauge,
sql_insert_started_count,Number of SQL INSERT statements started,,Sum,
sql_insert_started_count_internal,Number of SQL INSERT statements started (internal queries),,Sum,
sql_insert_count,Number of SQL INSERT statements successfully executed,,Sum,
sql_insights_anomaly_detection_fingerprints,Current number of statement fingerprints being monitored for anomaly detection,,Gauge,
gossip_bytes_sent,Number of sent gossip bytes,,Sum,
gossip_connections_outgoing,Number of active outgoing gossip connections,,Gauge,
gossip_bytes_received,Number of received gossip bytes,,Sum,
gossip_infos_received,Number of received gossip Info objects,,Sum,
gossip_connections_refused,Number of refused incoming gossip connections,,Sum,
gossip_infos_sent,Number of sent gossip Info objects,,Sum,
gossip_connections_incoming,Number of active incoming gossip connections,,Gauge,
txnwaitqueue_pushee_waiting,Number of pushees on the txn wait queue,,Gauge,STRING(3)
txnwaitqueue_pusher_wait_time,Histogram of durations spent in queue by pushers,,Histogram,STRING(3)
txnwaitqueue_pusher_slow,The total number of cases where a pusher waited more than the excessive wait threshold,,Gauge,STRING(3)
txnwaitqueue_deadlocks_total,Number of deadlocks detected by the txn wait queue,,Sum,STRING(3)
txnwaitqueue_pusher_waiting,Number of pushers on the txn wait queue,,Gauge,STRING(3)
txnwaitqueue_query_waiting,Number of transaction status queries waiting for an updated transaction record,,Gauge,STRING(3)
txnwaitqueue_query_wait_time,Histogram of durations spent in queue by queries,,Histogram,STRING(3)
sys_cpu_sys_percent,Current system cpu percentage,,Gauge,
sys_cpu_user_ns,Total user cpu time,,Gauge,
sys_cpu_user_percent,Current user cpu percentage,,Gauge,
sys_cpu_sys_ns,Total system cpu time,,Gauge,
sys_cpu_combined_percent_normalized,"Current user+system cpu percentage, normalized 0-1 by number of cores",,Gauge,
sys_cpu_now_ns,"Number of nanoseconds elapsed since January 1, 1970 UTC",,Gauge,
sqlliveness_write_successes,Number of update or insert calls successfully performed,,Sum,
sqlliveness_sessions_deletion_runs,Number of calls to delete sessions which have been performed,,Sum,
sqlliveness_is_alive_cache_hits,Number of calls to IsAlive that return from the cache,,Sum,
sqlliveness_write_failures,Number of update or insert calls which have failed,,Sum,
sqlliveness_sessions_deleted,Number of expired sessions which have been deleted,,Sum,
sqlliveness_is_alive_cache_misses,Number of calls to IsAlive that do not return from the cache,,Sum,
sql_optimizer_plan_cache_misses,Number of non-prepared statements for which a cached plan was not used,,Sum,
sql_optimizer_plan_cache_hits_internal,Number of non-prepared statements for which a cached plan was used (internal queries),,Sum,
sql_optimizer_fallback_count,Number of statements which the cost-based optimizer was unable to plan,,Sum,
sql_optimizer_plan_cache_misses_internal,Number of non-prepared statements for which a cached plan was not used (internal queries),,Sum,
sql_optimizer_plan_cache_hits,Number of non-prepared statements for which a cached plan was used,,Sum,
sql_optimizer_fallback_count_internal,Number of statements which the cost-based optimizer was unable to plan (internal queries),,Sum,
txn_server_side_retry_read_evaluation_failure,Number of read batches that were not successfully refreshed server side,,Sum,STRING(3)
txn_server_side_retry_read_evaluation_success,Number of read batches that were successfully refreshed server side,,Sum,STRING(3)
txn_server_side_retry_uncertainty_interval_error_failure,Number of batches that ran into uncertainty interval errors that were not successfully refreshed server side,,Sum,STRING(3)
txn_server_side_retry_write_evaluation_failure,Number of write batches that were not successfully refreshed server side,,Sum,STRING(3)
txn_server_side_retry_uncertainty_interval_error_success,Number of batches that ran into uncertainty interval errors that were successfully refreshed server side,,Sum,STRING(3)
txn_server_side_retry_write_evaluation_success,Number of write batches that were successfully refreshed server side,,Sum,STRING(3)
sql_hydrated_udf_cache_misses,counter on the number of cache misses,,Sum,
sql_hydrated_schema_cache_hits,counter on the number of cache hits,,Sum,
sql_hydrated_table_cache_misses,counter on the number of cache misses,,Sum,
sql_hydrated_udf_cache_hits,counter on the number of cache hits,,Sum,
sql_hydrated_schema_cache_misses,counter on the number of cache misses,,Sum,
sql_hydrated_table_cache_hits,counter on the number of cache hits,,Sum,
raft_process_workingnanos,Nanoseconds spent in store.processRaft() working.,,Sum,STRING(3)
raft_process_logcommit_latency,Latency histogram for committing Raft log entries to stable storage,,Histogram,STRING(3)
raft_process_applycommitted_latency,Latency histogram for applying all committed Raft commands in a Raft ready.,,Histogram,STRING(3)
raft_process_commandcommit_latency,Latency histogram for applying a batch of Raft commands to the state machine.,,Histogram,STRING(3)
raft_process_handleready_latency,Latency histogram for handling a Raft ready.,,Histogram,STRING(3)
raft_process_tickingnanos,Nanoseconds spent in store.processRaft() processing replica.Tick(),,Sum,STRING(3)
txnrecovery_attempts_pending,Number of transaction recovery attempts currently in-flight,,Gauge,STRING(3)
txnrecovery_failures,Number of transaction recovery attempts that failed,,Sum,STRING(3)
txnrecovery_successes_committed,Number of transaction recovery attempts that committed a transaction,,Sum,STRING(3)
txnrecovery_successes_pending,Number of transaction recovery attempts that left a transaction pending,,Sum,STRING(3)
txnrecovery_successes_aborted,Number of transaction recovery attempts that aborted a transaction,,Sum,STRING(3)
txnrecovery_attempts_total,Number of transaction recovery attempts executed,,Sum,STRING(3)
liveness_livenodes,Number of live nodes in the cluster (will be 0 if this node is not itself live),,Gauge,
liveness_heartbeatfailures,Number of failed node liveness heartbeats from this node,,Sum,
liveness_epochincrements,Number of times this node has incremented its liveness epoch,,Sum,
liveness_heartbeatsinflight,Number of in-flight liveness heartbeats from this node,,Gauge,
liveness_heartbeatsuccesses,Number of successful node liveness heartbeats from this node,,Sum,
liveness_heartbeatlatency,Node liveness heartbeat latency,,Histogram,
sql_select_started_count,Number of SQL SELECT statements started,,Sum,
sql_service_latency,Latency of SQL request execution,,Histogram,
sql_service_latency_internal,Latency of SQL request execution (internal queries),,Histogram,
sql_select_count,Number of SQL SELECT statements successfully executed,,Sum,
sql_select_started_count_internal,Number of SQL SELECT statements started (internal queries),,Sum,
sql_select_count_internal,Number of SQL SELECT statements successfully executed (internal queries),,Sum,
addsstable_delay_enginebackpressure,Amount by which evaluation of AddSSTable requests was delayed by storage-engine backpressure,,Sum,STRING(3)
addsstable_delay_total,Amount by which evaluation of AddSSTable requests was delayed,,Sum,STRING(3)
addsstable_applications,Number of SSTable ingestions applied (i.e. applied by Replicas),,Sum,STRING(3)
addsstable_copies,number of SSTable ingestions that required copying files during application,,Sum,STRING(3)
addsstable_proposals,Number of SSTable ingestions proposed (i.e. sent to Raft by lease holders),,Sum,STRING(3)
addsstable_aswrites,Number of SSTables ingested as normal writes.,,Sum,STRING(3)
rpc_heartbeats_failed,Gauge of current connections in the failed state,,Gauge,
rpc_heartbeats_loops_started,Counter of the number of connection heartbeat loops which have been started,,Sum,
rpc_heartbeats_initializing,Gauge of current connections in the initializing state,,Gauge,
rpc_heartbeats_loops_exited,Counter of the number of connection heartbeat loops which have exited with an error,,Sum,
rpc_heartbeats_nominal,Gauge of current connections in the nominal state,,Gauge,
kv_rangefeed_mem_system,Memory usage by rangefeeds on system ranges,,Gauge,
kv_rangefeed_budget_allocation_failed,Number of times RangeFeed failed because memory budget was exceeded,,Sum,STRING(3)
kv_rangefeed_budget_allocation_blocked,Number of times RangeFeed waited for budget availability,,Sum,STRING(3)
kv_rangefeed_mem_shared,Memory usage by rangefeeds,,Gauge,
kv_rangefeed_catchup_scan_nanos,Time spent in RangeFeed catchup scan,,Sum,STRING(3)
requests_slow_distsender,Number of replica-bound RPCs currently stuck or retrying for a long time.,,Gauge,
requests_slow_lease,Number of requests that have been stuck for a long time acquiring a lease.,,Gauge,STRING(3)
requests_slow_raft,Number of requests that have been stuck for a long time in the replication layer.,,Gauge,STRING(3)
requests_slow_latch,Number of requests that have been stuck for a long time acquiring latches.,,Gauge,STRING(3)
requests_backpressure_split,Number of backpressured writes waiting on a Range split.,,Gauge,STRING(3)
sql_ddl_started_count_internal,Number of SQL DDL statements started (internal queries),,Sum,
sql_ddl_started_count,Number of SQL DDL statements started,,Sum,
sql_ddl_count,Number of SQL DDL statements successfully executed,,Sum,
sql_ddl_count_internal,Number of SQL DDL statements successfully executed (internal queries),,Sum,
sql_update_started_count_internal,Number of SQL UPDATE statements started (internal queries),,Sum,
sql_update_count_internal,Number of SQL UPDATE statements successfully executed (internal queries),,Sum,
sql_update_count,Number of SQL UPDATE statements successfully executed,,Sum,
sql_update_started_count,Number of SQL UPDATE statements started,,Sum,
scrape_duration_seconds,Duration of the scrape,seconds,Gauge,
scrape_samples_scraped,The number of samples the target exposed,,Gauge,
scrape_samples_post_metric_relabeling,The number of samples remaining after metric relabeling was applied,,Gauge,
scrape_series_added,The approximate number of new series in this scrape,,Gauge,
raft_entrycache_size,Number of Raft entries in the Raft entry cache,,Gauge,STRING(3)
raft_entrycache_hits,Number of successful cache lookups in the Raft entry cache,,Sum,STRING(3)
raft_entrycache_bytes,Aggregate size of all Raft entries in the Raft entry cache,,Gauge,STRING(3)
raft_entrycache_accesses,Number of cache lookups in the Raft entry cache,,Sum,STRING(3)
ranges_unavailable,Number of ranges with fewer live replicas than needed for quorum,,Gauge,STRING(3)
ranges_underreplicated,Number of ranges with fewer live replicas than the replication target,,Gauge,STRING(3)
ranges,Number of ranges,,Gauge,STRING(3)
ranges_overreplicated,Number of ranges with more live replicas than the replication target,,Gauge,STRING(3)
capacity_available,Available storage capacity,,Gauge,STRING(3)
capacity_used,Used storage capacity,,Gauge,STRING(3)
capacity,Total storage capacity,,Gauge,STRING(3)
capacity_reserved,Capacity reserved for snapshots,,Gauge,STRING(3)
sql_delete_started_count,Number of SQL DELETE statements started,,Sum,
sql_delete_count_internal,Number of SQL DELETE statements successfully executed (internal queries),,Sum,
